{
  "kind": "vulnerability-scan",
  "project": "payments-service",
  "scanned_at": "2026-10-18T20:15:00Z",
  "findings": [
    { "id": "CVE-2026-5678", "package": "libxml2", "installed_version": "2.11.4",
      "fixed_version": "2.11.7", "severity": "HIGH" },
    { "id": "CVE-2026-3301", "package": "zlib", "installed_version": "1.3.0",
      "fixed_version": "1.3.1", "severity": "MEDIUM" },
    { "id": "CVE-2026-0917", "package": "curl", "installed_version": "8.4.0",
      "fixed_version": "8.5.0", "severity": "LOW" }
  ]
}
